{
  "modelArn": "arn:aws:deepracer:us-east-1:123456789012:model/reinforcement_learning/SpeedModel",
  "modelName": "SpeedModel",
  "creationTime": "2024-01-10T09:00:00Z",
  "lastModifiedTime": "2024-01-12T14:00:00Z",
  "modelStatus": "READY",
  "trainingJobArn": "arn:aws:sagemaker:us-east-1:123456789012:training-job/deepracer-job-123"
}